--
-- CONSTRAINTS
-- Constraints can be specified with:
--  - DEFAULT clause
--  - CHECK clauses
--  - PRIMARY KEY clauses
--  - UNIQUE clauses
--
--
-- DEFAULT syntax
--
CREATE TABLE DEFAULT_TBL (i int DEFAULT 100,
	x text DEFAULT 'vadim', f float8 DEFAULT 123.456);
INSERT INTO DEFAULT_TBL VALUES (1, 'thomas', 57.0613);
INSERT INTO DEFAULT_TBL VALUES (1, 'bruce');
INSERT INTO DEFAULT_TBL (i, f) VALUES (2, 987.654);
INSERT INTO DEFAULT_TBL (x) VALUES ('marc');
INSERT INTO DEFAULT_TBL VALUES (3, null, 1.0);
SELECT * FROM DEFAULT_TBL;
  i  |   x    |    f    
-----+--------+---------
   1 | thomas | 57.0613
   1 | bruce  | 123.456
   2 | vadim  | 987.654
 100 | marc   | 123.456
   3 |        |       1
(5 rows)

CREATE TABLE DEFAULTEXPR_TBL (i1 int DEFAULT 100 + (200-199) * 2,
	i2 int DEFAULT 7);
INSERT INTO DEFAULTEXPR_TBL VALUES (-1, -2);
INSERT INTO DEFAULTEXPR_TBL (i1) VALUES (-3);
INSERT INTO DEFAULTEXPR_TBL (i2) VALUES (-4);
INSERT INTO DEFAULTEXPR_TBL (i2) VALUES (NULL);
SELECT * FROM DEFAULTEXPR_TBL;
 i1  | i2 
-----+----
  -1 | -2
  -3 |  7
 102 | -4
 102 |   
(4 rows)

-- syntax errors
--  test for extraneous comma
CREATE TABLE error_tbl (i int DEFAULT (100, ));
ERROR:  syntax error at or near ")"
LINE 1: CREATE TABLE error_tbl (i int DEFAULT (100, ));
                                                    ^
--  this will fail because gram.y uses b_expr not a_expr for defaults,
--  to avoid a shift/reduce conflict that arises from NOT NULL being
--  part of the column definition syntax:
CREATE TABLE error_tbl (b1 bool DEFAULT 1 IN (1, 2));
ERROR:  syntax error at or near "IN"
LINE 1: CREATE TABLE error_tbl (b1 bool DEFAULT 1 IN (1, 2));
                                                  ^
--  this should work, however:
CREATE TABLE error_tbl (b1 bool DEFAULT (1 IN (1, 2)));
DROP TABLE error_tbl;
--
-- CHECK syntax
--
CREATE TABLE CHECK_TBL (x int,
	CONSTRAINT CHECK_CON CHECK (x > 3));
INSERT INTO CHECK_TBL VALUES (5);
INSERT INTO CHECK_TBL VALUES (4);
INSERT INTO CHECK_TBL VALUES (3);
ERROR:  new row for relation "check_tbl" violates check constraint "check_con"
DETAIL:  Failing row contains (3).
INSERT INTO CHECK_TBL VALUES (2);
ERROR:  new row for relation "check_tbl" violates check constraint "check_con"
DETAIL:  Failing row contains (2).
INSERT INTO CHECK_TBL VALUES (6);
INSERT INTO CHECK_TBL VALUES (1);
ERROR:  new row for relation "check_tbl" violates check constraint "check_con"
DETAIL:  Failing row contains (1).
SELECT * FROM CHECK_TBL;
 x 
---
 5
 4
 6
(3 rows)

CREATE TABLE CHECK2_TBL (x int, y text, z int,
	CONSTRAINT SEQUENCE_CON
	CHECK (x > 3 and y <> 'check failed' and z < 8));
INSERT INTO CHECK2_TBL VALUES (4, 'check ok', -2);
INSERT INTO CHECK2_TBL VALUES (1, 'x check failed', -2);
ERROR:  new row for relation "check2_tbl" violates check constraint "sequence_con"
DETAIL:  Failing row contains (1, x check failed, -2).
INSERT INTO CHECK2_TBL VALUES (5, 'z check failed', 10);
ERROR:  new row for relation "check2_tbl" violates check constraint "sequence_con"
DETAIL:  Failing row contains (5, z check failed, 10).
INSERT INTO CHECK2_TBL VALUES (0, 'check failed', -2);
ERROR:  new row for relation "check2_tbl" violates check constraint "sequence_con"
DETAIL:  Failing row contains (0, check failed, -2).
INSERT INTO CHECK2_TBL VALUES (6, 'check failed', 11);
ERROR:  new row for relation "check2_tbl" violates check constraint "sequence_con"
DETAIL:  Failing row contains (6, check failed, 11).
INSERT INTO CHECK2_TBL VALUES (7, 'check ok', 7);
SELECT * from CHECK2_TBL;
 x |    y     | z  
---+----------+----
 4 | check ok | -2
 7 | check ok |  7
(2 rows)

--
-- Check constraints on system columns
--
CREATE TABLE SYS_COL_CHECK_TBL (city text, state text, is_capital bool,
                  altitude int,
                  CHECK (NOT (is_capital AND tableoid::regclass::text = 'sys_col_check_tbl')));
INSERT INTO SYS_COL_CHECK_TBL VALUES ('Seattle', 'Washington', false, 100);
INSERT INTO SYS_COL_CHECK_TBL VALUES ('Olympia', 'Washington', true, 100);
ERROR:  new row for relation "sys_col_check_tbl" violates check constraint "sys_col_check_tbl_check"
DETAIL:  Failing row contains (Olympia, Washington, t, 100).
SELECT *, tableoid::regclass::text FROM SYS_COL_CHECK_TBL;
  city   |   state    | is_capital | altitude |     tableoid      
---------+------------+------------+----------+-------------------
 Seattle | Washington | f          |      100 | sys_col_check_tbl
(1 row)

DROP TABLE SYS_COL_CHECK_TBL;
--
-- Check constraints on system columns other then TableOid should return error
--
CREATE TABLE SYS_COL_CHECK_TBL (city text, state text, is_capital bool,
                  altitude int,
				  CHECK (NOT (is_capital AND ctid::text = 'sys_col_check_tbl')));
ERROR:  system column "ctid" reference in check constraint is invalid
LINE 3:       CHECK (NOT (is_capital AND ctid::text = 'sys_col_check...
                                         ^

--
-- Check NO INHERIT type of constraints and inheritance
--
CREATE TABLE ATACC1 (TEST INT
	CHECK (TEST > 0) NO INHERIT);
CREATE TABLE ATACC2 (TEST2 INT) INHERITS (ATACC1);
-- check constraint is not there on child
INSERT INTO ATACC2 (TEST) VALUES (-3);
-- check constraint is there on parent
INSERT INTO ATACC1 (TEST) VALUES (-3);
ERROR:  new row for relation "atacc1" violates check constraint "atacc1_test_check"
DETAIL:  Failing row contains (-3).
DROP TABLE ATACC1 CASCADE;
NOTICE:  drop cascades to table atacc2
CREATE TABLE ATACC1 (TEST INT, TEST2 INT
	CHECK (TEST > 0), CHECK (TEST2 > 10) NO INHERIT);
CREATE TABLE ATACC2 () INHERITS (ATACC1);
-- check constraint is there on child
INSERT INTO ATACC2 (TEST) VALUES (-3);
ERROR:  new row for relation "atacc2" violates check constraint "atacc1_test_check"
DETAIL:  Failing row contains (-3, null).
-- check constraint is there on parent
INSERT INTO ATACC1 (TEST) VALUES (-3);
ERROR:  new row for relation "atacc1" violates check constraint "atacc1_test_check"
DETAIL:  Failing row contains (-3, null).
-- check constraint is not there on child
INSERT INTO ATACC2 (TEST2) VALUES (3);
-- check constraint is there on parent
INSERT INTO ATACC1 (TEST2) VALUES (3);
ERROR:  new row for relation "atacc1" violates check constraint "atacc1_test2_check"
DETAIL:  Failing row contains (null, 3).
DROP TABLE ATACC1 CASCADE;
NOTICE:  drop cascades to table atacc2
--
-- Check constraints on COPY FROM
--
CREATE TABLE COPY_TBL (x INT, y TEXT, z INT,
	CONSTRAINT COPY_CON
	CHECK (x > 3 AND y <> 'check failed' AND x < 7 ));
COPY COPY_TBL FROM '@abs_srcdir@/data/constro.data';
SELECT * FROM COPY_TBL;
 x |       y       | z 
---+---------------+---
 4 | !check failed | 5
 6 | OK            | 4
(2 rows)

COPY COPY_TBL FROM '@abs_srcdir@/data/constrf.data';
ERROR:  new row for relation "copy_tbl" violates check constraint "copy_con"
DETAIL:  Failing row contains (7, check failed, 6).
CONTEXT:  COPY copy_tbl, line 2: "7	check failed	6"
SELECT * FROM COPY_TBL;
 x |       y       | z 
---+---------------+---
 4 | !check failed | 5
 6 | OK            | 4
(2 rows)

--
-- Primary keys
--
CREATE TABLE PRIMARY_TBL (i int PRIMARY KEY, t text);
INSERT INTO PRIMARY_TBL VALUES (1, 'one');
INSERT INTO PRIMARY_TBL VALUES (2, 'two');
INSERT INTO PRIMARY_TBL VALUES (1, 'three');
ERROR:  duplicate key value violates unique constraint "primary_tbl_pkey"
DETAIL:  Key (i)=(1) already exists.
INSERT INTO PRIMARY_TBL VALUES (4, 'three');
INSERT INTO PRIMARY_TBL VALUES (5, 'one');
INSERT INTO PRIMARY_TBL (t) VALUES ('six');
ERROR:  null value in column "i" of relation "primary_tbl" violates not-null constraint
DETAIL:  Failing row contains (null, six).
SELECT * FROM PRIMARY_TBL;
 i |   t   
---+-------
 1 | one
 2 | two
 4 | three
 5 | one
(4 rows)

DROP TABLE PRIMARY_TBL;
CREATE TABLE PRIMARY_TBL (i int, t text,
	PRIMARY KEY(i,t));
INSERT INTO PRIMARY_TBL VALUES (1, 'one');
INSERT INTO PRIMARY_TBL VALUES (2, 'two');
INSERT INTO PRIMARY_TBL VALUES (1, 'three');
INSERT INTO PRIMARY_TBL VALUES (4, 'three');
INSERT INTO PRIMARY_TBL VALUES (5, 'one');
INSERT INTO PRIMARY_TBL (t) VALUES ('six');
ERROR:  null value in column "i" of relation "primary_tbl" violates not-null constraint
DETAIL:  Failing row contains (null, six).
SELECT * FROM PRIMARY_TBL;
 i |   t   
---+-------
 1 | one
 2 | two
 1 | three
 4 | three
 5 | one
(5 rows)

DROP TABLE PRIMARY_TBL;
--
-- Unique keys
--
CREATE TABLE UNIQUE_TBL (i int UNIQUE, t text);
INSERT INTO UNIQUE_TBL VALUES (1, 'one');
INSERT INTO UNIQUE_TBL VALUES (2, 'two');
INSERT INTO UNIQUE_TBL VALUES (1, 'three');
ERROR:  duplicate key value violates unique constraint "unique_tbl_i_key"
DETAIL:  Key (i)=(1) already exists.
INSERT INTO UNIQUE_TBL VALUES (4, 'four');
INSERT INTO UNIQUE_TBL VALUES (5, 'one');
INSERT INTO UNIQUE_TBL (t) VALUES ('six');
INSERT INTO UNIQUE_TBL (t) VALUES ('seven');
INSERT INTO UNIQUE_TBL VALUES (5, 'five-upsert-insert') ON CONFLICT (i) DO UPDATE SET t = 'five-upsert-update';
INSERT INTO UNIQUE_TBL VALUES (6, 'six-upsert-insert') ON CONFLICT (i) DO UPDATE SET t = 'six-upsert-update';
-- should fail
INSERT INTO UNIQUE_TBL VALUES (1, 'a'), (2, 'b'), (2, 'b') ON CONFLICT (i) DO UPDATE SET t = 'fails';
ERROR:  ON CONFLICT DO UPDATE command cannot affect row a second time
HINT:  Ensure that no rows proposed for insertion within the same command have duplicate constrained values.
SELECT * FROM UNIQUE_TBL;
 i |         t          
---+--------------------
 1 | one
 2 | two
 4 | four
   | six
   | seven
 5 | five-upsert-update
 6 | six-upsert-insert
(7 rows)

DROP TABLE UNIQUE_TBL;
CREATE TABLE UNIQUE_TBL (i int, t text,
	UNIQUE(i,t));
INSERT INTO UNIQUE_TBL VALUES (1, 'one');
INSERT INTO UNIQUE_TBL VALUES (2, 'two');
INSERT INTO UNIQUE_TBL VALUES (1, 'three');
INSERT INTO UNIQUE_TBL VALUES (1, 'one');
ERROR:  duplicate key value violates unique constraint "unique_tbl_i_t_key"
DETAIL:  Key (i, t)=(1, one) already exists.
INSERT INTO UNIQUE_TBL VALUES (5, 'one');
INSERT INTO UNIQUE_TBL (t) VALUES ('six');
SELECT * FROM UNIQUE_TBL;
 i |   t   
---+-------
 1 | one
 2 | two
 1 | three
 5 | one
   | six
(5 rows)

DROP TABLE UNIQUE_TBL;
-- test naming a constraint in a partition when a conflict exists
CREATE TABLE parted_fk_naming (
    id bigint NOT NULL default 1,
    id_abc bigint,
    CONSTRAINT dummy_constr FOREIGN KEY (id_abc)
        REFERENCES parted_fk_naming (id),
    PRIMARY KEY (id)
)
PARTITION BY LIST (id);
CREATE TABLE parted_fk_naming_1 (
    id bigint NOT NULL default 1,
    id_abc bigint,
    PRIMARY KEY (id),
    CONSTRAINT dummy_constr CHECK (true)
);
ALTER TABLE parted_fk_naming ATTACH PARTITION parted_fk_naming_1 FOR VALUES IN ('1');
SELECT conname FROM pg_constraint WHERE conrelid = 'parted_fk_naming_1'::regclass AND contype = 'f';
            conname             
--------------------------------
 parted_fk_naming_1_id_abc_fkey
(1 row)

DROP TABLE parted_fk_naming;
--
-- Test various ways to create primary keys on partitions, linked to unique
-- indexes (without constraints) on the partitioned table.  Ideally these should
-- fail, but we don't dare change released behavior, so instead cope with it at
-- DETACH time.
CREATE TABLE t (a integer, b integer) PARTITION BY HASH (a, b);
CREATE TABLE tp (a integer, b integer, PRIMARY KEY (a, b), UNIQUE (b, a));
ALTER TABLE t ATTACH PARTITION tp FOR VALUES WITH (MODULUS 1, REMAINDER 0);
CREATE UNIQUE INDEX t_a_idx ON t (a, b);
CREATE UNIQUE INDEX t_b_idx ON t (b, a);
ALTER INDEX t_a_idx ATTACH PARTITION tp_pkey;
ALTER INDEX t_b_idx ATTACH PARTITION tp_b_a_key;
ALTER TABLE t DETACH PARTITION tp;
SELECT conname, conparentid, conislocal, coninhcount
  FROM pg_constraint WHERE conname IN ('tp_pkey', 'tp_b_a_key')
  ORDER BY conname DESC;
  conname   | conparentid | conislocal | coninhcount 
------------+-------------+------------+-------------
 tp_pkey    |           0 | t          |           0
 tp_b_a_key |           0 | t          |           0
(2 rows)

DROP TABLE t, tp;
CREATE TABLE t (a integer) PARTITION BY LIST (a);
CREATE TABLE tp (a integer PRIMARY KEY);
CREATE UNIQUE INDEX t_a_idx ON t (a);
ALTER TABLE t ATTACH PARTITION tp FOR VALUES IN (1);
ALTER TABLE t DETACH PARTITION tp;
DROP TABLE t, tp;
CREATE TABLE t (a integer) PARTITION BY LIST (a);
CREATE TABLE tp (a integer PRIMARY KEY);
CREATE UNIQUE INDEX t_a_idx ON ONLY t (a);
ALTER TABLE t ATTACH PARTITION tp FOR VALUES IN (1);
ALTER TABLE t DETACH PARTITION tp;
DROP TABLE t, tp;
CREATE TABLE regress_constr_partitioned (a integer) PARTITION BY LIST (a);
CREATE TABLE regress_constr_partition1 PARTITION OF regress_constr_partitioned FOR VALUES IN (1);
ALTER TABLE regress_constr_partition1 ADD PRIMARY KEY (a);
CREATE UNIQUE INDEX ON regress_constr_partitioned (a);
BEGIN;
ALTER TABLE regress_constr_partitioned DETACH PARTITION regress_constr_partition1;
ROLLBACK;
--  Leave this one in funny state for pg_upgrade testing
-- test a HOT update that invalidates the conflicting tuple.
-- the trigger should still fire and catch the violation
BEGIN;
INSERT INTO unique_tbl VALUES (3, 'Three'); -- should succeed for now
UPDATE unique_tbl SET t = 'THREE' WHERE i = 3 AND t = 'Three';
COMMIT; -- should fail
ERROR:  duplicate key value violates unique constraint "unique_tbl_i_key"
DETAIL:  Key (i)=(3) already exists.
SELECT * FROM unique_tbl;
 i |   t   
---+-------
 3 | three
 1 | five
 5 | one
 4 | two
 2 | four
(5 rows)

-- test a HOT update that modifies the newly inserted tuple,
-- but should succeed because we then remove the other conflicting tuple.
BEGIN;
INSERT INTO unique_tbl VALUES(3, 'tree'); -- should succeed for now
UPDATE unique_tbl SET t = 'threex' WHERE t = 'tree';
DELETE FROM unique_tbl WHERE t = 'three';
SELECT * FROM unique_tbl;
 i |   t    
---+--------
 1 | five
 5 | one
 4 | two
 2 | four
 3 | threex
(5 rows)

COMMIT;
SELECT * FROM unique_tbl;
 i |   t    
---+--------
 1 | five
 5 | one
 4 | two
 2 | four
 3 | threex
(5 rows)

DROP TABLE unique_tbl;
