--
--  CLUSTER
--
CREATE TABLE clstr_tst_s (rf_a SERIAL PRIMARY KEY,
	b INT);
CREATE TABLE clstr_tst (a SERIAL PRIMARY KEY,
	b INT,
	c TEXT,
	d TEXT,
	CONSTRAINT clstr_tst_con FOREIGN KEY (b) REFERENCES clstr_tst_s);
ERROR:  foreign key constraints are not supported in minipg
LINE 5:  CONSTRAINT clstr_tst_con FOREIGN KEY (b) REFERENCES clstr_t...
                                  ^
CREATE INDEX clstr_tst_b ON clstr_tst (b);
ERROR:  relation "clstr_tst" does not exist
CREATE INDEX clstr_tst_c ON clstr_tst (c);
ERROR:  relation "clstr_tst" does not exist
CREATE INDEX clstr_tst_c_b ON clstr_tst (c,b);
ERROR:  relation "clstr_tst" does not exist
CREATE INDEX clstr_tst_b_c ON clstr_tst (b,c);
ERROR:  relation "clstr_tst" does not exist
INSERT INTO clstr_tst_s (b) VALUES (0);
INSERT INTO clstr_tst_s (b) SELECT b FROM clstr_tst_s;
INSERT INTO clstr_tst_s (b) SELECT b FROM clstr_tst_s;
INSERT INTO clstr_tst_s (b) SELECT b FROM clstr_tst_s;
INSERT INTO clstr_tst_s (b) SELECT b FROM clstr_tst_s;
INSERT INTO clstr_tst_s (b) SELECT b FROM clstr_tst_s;
CREATE TABLE clstr_tst_inh () INHERITS (clstr_tst);
ERROR:  relation "clstr_tst" does not exist
INSERT INTO clstr_tst (b, c) VALUES (11, 'once');
ERROR:  relation "clstr_tst" does not exist
LINE 1: INSERT INTO clstr_tst (b, c) VALUES (11, 'once');
                    ^
INSERT INTO clstr_tst (b, c) VALUES (10, 'diez');
ERROR:  relation "clstr_tst" does not exist
LINE 1: INSERT INTO clstr_tst (b, c) VALUES (10, 'diez');
                    ^
INSERT INTO clstr_tst (b, c) VALUES (31, 'treinta y uno');
ERROR:  relation "clstr_tst" does not exist
LINE 1: INSERT INTO clstr_tst (b, c) VALUES (31, 'treinta y uno');
                    ^
INSERT INTO clstr_tst (b, c) VALUES (22, 'veintidos');
ERROR:  relation "clstr_tst" does not exist
LINE 1: INSERT INTO clstr_tst (b, c) VALUES (22, 'veintidos');
                    ^
INSERT INTO clstr_tst (b, c) VALUES (3, 'tres');
ERROR:  relation "clstr_tst" does not exist
LINE 1: INSERT INTO clstr_tst (b, c) VALUES (3, 'tres');
                    ^
INSERT INTO clstr_tst (b, c) VALUES (20, 'veinte');
ERROR:  relation "clstr_tst" does not exist
LINE 1: INSERT INTO clstr_tst (b, c) VALUES (20, 'veinte');
                    ^
INSERT INTO clstr_tst (b, c) VALUES (23, 'veintitres');
ERROR:  relation "clstr_tst" does not exist
LINE 1: INSERT INTO clstr_tst (b, c) VALUES (23, 'veintitres');
                    ^
INSERT INTO clstr_tst (b, c) VALUES (21, 'veintiuno');
ERROR:  relation "clstr_tst" does not exist
LINE 1: INSERT INTO clstr_tst (b, c) VALUES (21, 'veintiuno');
                    ^
INSERT INTO clstr_tst (b, c) VALUES (4, 'cuatro');
ERROR:  relation "clstr_tst" does not exist
LINE 1: INSERT INTO clstr_tst (b, c) VALUES (4, 'cuatro');
                    ^
INSERT INTO clstr_tst (b, c) VALUES (14, 'catorce');
ERROR:  relation "clstr_tst" does not exist
LINE 1: INSERT INTO clstr_tst (b, c) VALUES (14, 'catorce');
                    ^
INSERT INTO clstr_tst (b, c) VALUES (2, 'dos');
ERROR:  relation "clstr_tst" does not exist
LINE 1: INSERT INTO clstr_tst (b, c) VALUES (2, 'dos');
                    ^
INSERT INTO clstr_tst (b, c) VALUES (18, 'dieciocho');
ERROR:  relation "clstr_tst" does not exist
LINE 1: INSERT INTO clstr_tst (b, c) VALUES (18, 'dieciocho');
                    ^
INSERT INTO clstr_tst (b, c) VALUES (27, 'veintisiete');
ERROR:  relation "clstr_tst" does not exist
LINE 1: INSERT INTO clstr_tst (b, c) VALUES (27, 'veintisiete');
                    ^
INSERT INTO clstr_tst (b, c) VALUES (25, 'veinticinco');
ERROR:  relation "clstr_tst" does not exist
LINE 1: INSERT INTO clstr_tst (b, c) VALUES (25, 'veinticinco');
                    ^
INSERT INTO clstr_tst (b, c) VALUES (13, 'trece');
ERROR:  relation "clstr_tst" does not exist
LINE 1: INSERT INTO clstr_tst (b, c) VALUES (13, 'trece');
                    ^
INSERT INTO clstr_tst (b, c) VALUES (28, 'veintiocho');
ERROR:  relation "clstr_tst" does not exist
LINE 1: INSERT INTO clstr_tst (b, c) VALUES (28, 'veintiocho');
                    ^
INSERT INTO clstr_tst (b, c) VALUES (32, 'treinta y dos');
ERROR:  relation "clstr_tst" does not exist
LINE 1: INSERT INTO clstr_tst (b, c) VALUES (32, 'treinta y dos');
                    ^
INSERT INTO clstr_tst (b, c) VALUES (5, 'cinco');
ERROR:  relation "clstr_tst" does not exist
LINE 1: INSERT INTO clstr_tst (b, c) VALUES (5, 'cinco');
                    ^
INSERT INTO clstr_tst (b, c) VALUES (29, 'veintinueve');
ERROR:  relation "clstr_tst" does not exist
LINE 1: INSERT INTO clstr_tst (b, c) VALUES (29, 'veintinueve');
                    ^
INSERT INTO clstr_tst (b, c) VALUES (1, 'uno');
ERROR:  relation "clstr_tst" does not exist
LINE 1: INSERT INTO clstr_tst (b, c) VALUES (1, 'uno');
                    ^
INSERT INTO clstr_tst (b, c) VALUES (24, 'veinticuatro');
ERROR:  relation "clstr_tst" does not exist
LINE 1: INSERT INTO clstr_tst (b, c) VALUES (24, 'veinticuatro');
                    ^
INSERT INTO clstr_tst (b, c) VALUES (30, 'treinta');
ERROR:  relation "clstr_tst" does not exist
LINE 1: INSERT INTO clstr_tst (b, c) VALUES (30, 'treinta');
                    ^
INSERT INTO clstr_tst (b, c) VALUES (12, 'doce');
ERROR:  relation "clstr_tst" does not exist
LINE 1: INSERT INTO clstr_tst (b, c) VALUES (12, 'doce');
                    ^
INSERT INTO clstr_tst (b, c) VALUES (17, 'diecisiete');
ERROR:  relation "clstr_tst" does not exist
LINE 1: INSERT INTO clstr_tst (b, c) VALUES (17, 'diecisiete');
                    ^
INSERT INTO clstr_tst (b, c) VALUES (9, 'nueve');
ERROR:  relation "clstr_tst" does not exist
LINE 1: INSERT INTO clstr_tst (b, c) VALUES (9, 'nueve');
                    ^
INSERT INTO clstr_tst (b, c) VALUES (19, 'diecinueve');
ERROR:  relation "clstr_tst" does not exist
LINE 1: INSERT INTO clstr_tst (b, c) VALUES (19, 'diecinueve');
                    ^
INSERT INTO clstr_tst (b, c) VALUES (26, 'veintiseis');
ERROR:  relation "clstr_tst" does not exist
LINE 1: INSERT INTO clstr_tst (b, c) VALUES (26, 'veintiseis');
                    ^
INSERT INTO clstr_tst (b, c) VALUES (15, 'quince');
ERROR:  relation "clstr_tst" does not exist
LINE 1: INSERT INTO clstr_tst (b, c) VALUES (15, 'quince');
                    ^
INSERT INTO clstr_tst (b, c) VALUES (7, 'siete');
ERROR:  relation "clstr_tst" does not exist
LINE 1: INSERT INTO clstr_tst (b, c) VALUES (7, 'siete');
                    ^
INSERT INTO clstr_tst (b, c) VALUES (16, 'dieciseis');
ERROR:  relation "clstr_tst" does not exist
LINE 1: INSERT INTO clstr_tst (b, c) VALUES (16, 'dieciseis');
                    ^
INSERT INTO clstr_tst (b, c) VALUES (8, 'ocho');
ERROR:  relation "clstr_tst" does not exist
LINE 1: INSERT INTO clstr_tst (b, c) VALUES (8, 'ocho');
                    ^
-- This entry is needed to test that TOASTED values are copied correctly.
INSERT INTO clstr_tst (b, c, d) VALUES (6, 'seis', repeat('xyzzy', 100000));
ERROR:  relation "clstr_tst" does not exist
LINE 1: INSERT INTO clstr_tst (b, c, d) VALUES (6, 'seis', repeat('x...
                    ^
CLUSTER clstr_tst_c ON clstr_tst;
ERROR:  relation "clstr_tst" does not exist
SELECT a,b,c,substring(d for 30), length(d) from clstr_tst;
ERROR:  relation "clstr_tst" does not exist
LINE 1: SELECT a,b,c,substring(d for 30), length(d) from clstr_tst;
                                                         ^
SELECT a,b,c,substring(d for 30), length(d) from clstr_tst ORDER BY a;
ERROR:  relation "clstr_tst" does not exist
LINE 1: SELECT a,b,c,substring(d for 30), length(d) from clstr_tst O...
                                                         ^
SELECT a,b,c,substring(d for 30), length(d) from clstr_tst ORDER BY b;
ERROR:  relation "clstr_tst" does not exist
LINE 1: SELECT a,b,c,substring(d for 30), length(d) from clstr_tst O...
                                                         ^
SELECT a,b,c,substring(d for 30), length(d) from clstr_tst ORDER BY c;
ERROR:  relation "clstr_tst" does not exist
LINE 1: SELECT a,b,c,substring(d for 30), length(d) from clstr_tst O...
                                                         ^
-- Verify that inheritance link still works
INSERT INTO clstr_tst_inh VALUES (0, 100, 'in child table');
ERROR:  relation "clstr_tst_inh" does not exist
LINE 1: INSERT INTO clstr_tst_inh VALUES (0, 100, 'in child table');
                    ^
SELECT a,b,c,substring(d for 30), length(d) from clstr_tst;
ERROR:  relation "clstr_tst" does not exist
LINE 1: SELECT a,b,c,substring(d for 30), length(d) from clstr_tst;
                                                         ^
-- Verify that foreign key link still works
INSERT INTO clstr_tst (b, c) VALUES (1111, 'this should fail');
ERROR:  relation "clstr_tst" does not exist
LINE 1: INSERT INTO clstr_tst (b, c) VALUES (1111, 'this should fail...
                    ^
SELECT conname FROM pg_constraint WHERE conrelid = 'clstr_tst'::regclass
ORDER BY 1;
ERROR:  relation "clstr_tst" does not exist
LINE 1: ...ELECT conname FROM pg_constraint WHERE conrelid = 'clstr_tst...
                                                             ^
SELECT relname, relkind,
    EXISTS(SELECT 1 FROM pg_class WHERE oid = c.reltoastrelid) AS hastoast
FROM pg_class c WHERE relname LIKE 'clstr_tst%' ORDER BY relname;
       relname        | relkind | hastoast 
----------------------+---------+----------
 clstr_tst_s          | r       | f
 clstr_tst_s_pkey     | i       | f
 clstr_tst_s_rf_a_seq | S       | f
(3 rows)

-- Verify that indisclustered is correctly set
SELECT pg_class.relname FROM pg_index, pg_class, pg_class AS pg_class_2
WHERE pg_class.oid=indexrelid
	AND indrelid=pg_class_2.oid
	AND pg_class_2.relname = 'clstr_tst'
	AND indisclustered;
 relname 
---------
(0 rows)

-- Try changing indisclustered
ALTER TABLE clstr_tst CLUSTER ON clstr_tst_b_c;
ERROR:  relation "clstr_tst" does not exist
SELECT pg_class.relname FROM pg_index, pg_class, pg_class AS pg_class_2
WHERE pg_class.oid=indexrelid
	AND indrelid=pg_class_2.oid
	AND pg_class_2.relname = 'clstr_tst'
	AND indisclustered;
 relname 
---------
(0 rows)

-- Try turning off all clustering
ALTER TABLE clstr_tst SET WITHOUT CLUSTER;
ERROR:  relation "clstr_tst" does not exist
SELECT pg_class.relname FROM pg_index, pg_class, pg_class AS pg_class_2
WHERE pg_class.oid=indexrelid
	AND indrelid=pg_class_2.oid
	AND pg_class_2.relname = 'clstr_tst'
	AND indisclustered;
 relname 
---------
(0 rows)

-- Verify that clustering all tables does in fact cluster the right ones
CREATE TABLE clstr_1 (a INT PRIMARY KEY);
CREATE TABLE clstr_2 (a INT PRIMARY KEY);
CREATE TABLE clstr_3 (a INT PRIMARY KEY);
INSERT INTO clstr_1 VALUES (2);
INSERT INTO clstr_1 VALUES (1);
INSERT INTO clstr_2 VALUES (2);
INSERT INTO clstr_2 VALUES (1);
INSERT INTO clstr_3 VALUES (2);
INSERT INTO clstr_3 VALUES (1);
-- "CLUSTER <tablename>" on a table that hasn't been clustered
CLUSTER clstr_2;
ERROR:  there is no previously clustered index for table "clstr_2"
CLUSTER clstr_1_pkey ON clstr_1;
CLUSTER clstr_2 USING clstr_2_pkey;
SELECT * FROM clstr_1 UNION ALL
  SELECT * FROM clstr_2 UNION ALL
  SELECT * FROM clstr_3;
 a 
---
 1
 2
 1
 2
 2
 1
(6 rows)

-- revert to the original state
DELETE FROM clstr_1;
DELETE FROM clstr_2;
DELETE FROM clstr_3;
INSERT INTO clstr_1 VALUES (2);
INSERT INTO clstr_1 VALUES (1);
INSERT INTO clstr_2 VALUES (2);
INSERT INTO clstr_2 VALUES (1);
INSERT INTO clstr_3 VALUES (2);
INSERT INTO clstr_3 VALUES (1);
-- this user can only cluster clstr_1 and clstr_3, but the latter
-- has not been clustered
CLUSTER;
SELECT * FROM clstr_1 UNION ALL
  SELECT * FROM clstr_2 UNION ALL
  SELECT * FROM clstr_3;
 a 
---
 1
 2
 1
 2
 2
 1
(6 rows)

-- cluster a single table using the indisclustered bit previously set
DELETE FROM clstr_1;
INSERT INTO clstr_1 VALUES (2);
INSERT INTO clstr_1 VALUES (1);
CLUSTER clstr_1;
SELECT * FROM clstr_1;
 a 
---
 1
 2
(2 rows)

-- Test MVCC-safety of cluster. There isn't much we can do to verify the
-- results with a single backend...
CREATE TABLE clustertest (key int PRIMARY KEY);
INSERT INTO clustertest VALUES (10);
INSERT INTO clustertest VALUES (20);
INSERT INTO clustertest VALUES (30);
INSERT INTO clustertest VALUES (40);
INSERT INTO clustertest VALUES (50);
-- Use a transaction so that updates are not committed when CLUSTER sees 'em
BEGIN;
-- Test update where the old row version is found first in the scan
UPDATE clustertest SET key = 100 WHERE key = 10;
-- Test update where the new row version is found first in the scan
UPDATE clustertest SET key = 35 WHERE key = 40;
-- Test longer update chain
UPDATE clustertest SET key = 60 WHERE key = 50;
UPDATE clustertest SET key = 70 WHERE key = 60;
UPDATE clustertest SET key = 80 WHERE key = 70;
SELECT * FROM clustertest;
 key 
-----
  20
  30
 100
  35
  80
(5 rows)

CLUSTER clustertest_pkey ON clustertest;
SELECT * FROM clustertest;
 key 
-----
  20
  30
  35
  80
 100
(5 rows)

COMMIT;
SELECT * FROM clustertest;
 key 
-----
  20
  30
  35
  80
 100
(5 rows)

-- check that temp tables can be clustered
create temp table clstr_temp (col1 int primary key, col2 text);
insert into clstr_temp values (2, 'two'), (1, 'one');
cluster clstr_temp using clstr_temp_pkey;
select * from clstr_temp;
 col1 | col2 
------+------
    1 | one
    2 | two
(2 rows)

drop table clstr_temp;
-- check clustering an empty table
DROP TABLE clustertest;
CREATE TABLE clustertest (f1 int PRIMARY KEY);
CLUSTER clustertest USING clustertest_pkey;
CLUSTER clustertest;
-- Check that partitioned tables cannot be clustered
CREATE TABLE clstrpart (a int) PARTITION BY RANGE (a);
CREATE INDEX clstrpart_idx ON clstrpart (a);
ALTER TABLE clstrpart CLUSTER ON clstrpart_idx;
ERROR:  cannot mark index clustered in partitioned table
CLUSTER clstrpart USING clstrpart_idx;
ERROR:  cannot cluster a partitioned table
DROP TABLE clstrpart;
-- Test CLUSTER with external tuplesorting
create table clstr_4 as select * from tenk1;
ERROR:  syntax error at or near "as"
LINE 1: create table clstr_4 as select * from tenk1;
                             ^
create index cluster_sort on clstr_4 (hundred, thousand, tenthous);
ERROR:  relation "clstr_4" does not exist
-- ensure we don't use the index in CLUSTER nor the checking SELECTs
set enable_indexscan = off;
-- Use external sort:
set maintenance_work_mem = '1MB';
cluster clstr_4 using cluster_sort;
ERROR:  relation "clstr_4" does not exist
select * from
(select hundred, lag(hundred) over () as lhundred,
        thousand, lag(thousand) over () as lthousand,
        tenthous, lag(tenthous) over () as ltenthous from clstr_4) ss
where row(hundred, thousand, tenthous) <= row(lhundred, lthousand, ltenthous);
ERROR:  relation "clstr_4" does not exist
LINE 4: ...tenthous, lag(tenthous) over () as ltenthous from clstr_4) s...
                                                             ^
reset enable_indexscan;
reset maintenance_work_mem;
-- test CLUSTER on expression index
CREATE TABLE clstr_expression(id serial primary key, a int, b text COLLATE "C");
INSERT INTO clstr_expression(a, b) SELECT g.i % 42, 'prefix'||g.i FROM generate_series(1, 133) g(i);
CREATE INDEX clstr_expression_minus_a ON clstr_expression ((-a), b);
CREATE INDEX clstr_expression_upper_b ON clstr_expression ((upper(b)));
-- verify indexes work before cluster
BEGIN;
SET LOCAL enable_seqscan = false;
EXPLAIN (COSTS OFF) SELECT * FROM clstr_expression WHERE upper(b) = 'PREFIX3';
                          QUERY PLAN                           
---------------------------------------------------------------
 Index Scan using clstr_expression_upper_b on clstr_expression
   Index Cond: (upper(b) = 'PREFIX3'::text)
(2 rows)

SELECT * FROM clstr_expression WHERE upper(b) = 'PREFIX3';
 id | a |    b    
----+---+---------
  3 | 3 | prefix3
(1 row)

EXPLAIN (COSTS OFF) SELECT * FROM clstr_expression WHERE -a = -3 ORDER BY -a, b;
                          QUERY PLAN                           
---------------------------------------------------------------
 Index Scan using clstr_expression_minus_a on clstr_expression
   Index Cond: ((- a) = '-3'::integer)
(2 rows)

SELECT * FROM clstr_expression WHERE -a = -3 ORDER BY -a, b;
 id  | a |     b     
-----+---+-----------
 129 | 3 | prefix129
   3 | 3 | prefix3
  45 | 3 | prefix45
  87 | 3 | prefix87
(4 rows)

COMMIT;
-- and after clustering on clstr_expression_minus_a
CLUSTER clstr_expression USING clstr_expression_minus_a;
WITH rows AS
  (SELECT ctid, lag(a) OVER (ORDER BY ctid) AS la, a FROM clstr_expression)
SELECT * FROM rows WHERE la < a;
 ctid | la | a 
------+----+---
(0 rows)

BEGIN;
SET LOCAL enable_seqscan = false;
EXPLAIN (COSTS OFF) SELECT * FROM clstr_expression WHERE upper(b) = 'PREFIX3';
                          QUERY PLAN                           
---------------------------------------------------------------
 Index Scan using clstr_expression_upper_b on clstr_expression
   Index Cond: (upper(b) = 'PREFIX3'::text)
(2 rows)

SELECT * FROM clstr_expression WHERE upper(b) = 'PREFIX3';
 id | a |    b    
----+---+---------
  3 | 3 | prefix3
(1 row)

EXPLAIN (COSTS OFF) SELECT * FROM clstr_expression WHERE -a = -3 ORDER BY -a, b;
                          QUERY PLAN                           
---------------------------------------------------------------
 Index Scan using clstr_expression_minus_a on clstr_expression
   Index Cond: ((- a) = '-3'::integer)
(2 rows)

SELECT * FROM clstr_expression WHERE -a = -3 ORDER BY -a, b;
 id  | a |     b     
-----+---+-----------
 129 | 3 | prefix129
   3 | 3 | prefix3
  45 | 3 | prefix45
  87 | 3 | prefix87
(4 rows)

COMMIT;
-- and after clustering on clstr_expression_upper_b
CLUSTER clstr_expression USING clstr_expression_upper_b;
WITH rows AS
  (SELECT ctid, lag(b) OVER (ORDER BY ctid) AS lb, b FROM clstr_expression)
SELECT * FROM rows WHERE upper(lb) > upper(b);
 ctid | lb | b 
------+----+---
(0 rows)

BEGIN;
SET LOCAL enable_seqscan = false;
EXPLAIN (COSTS OFF) SELECT * FROM clstr_expression WHERE upper(b) = 'PREFIX3';
                          QUERY PLAN                           
---------------------------------------------------------------
 Index Scan using clstr_expression_upper_b on clstr_expression
   Index Cond: (upper(b) = 'PREFIX3'::text)
(2 rows)

SELECT * FROM clstr_expression WHERE upper(b) = 'PREFIX3';
 id | a |    b    
----+---+---------
  3 | 3 | prefix3
(1 row)

EXPLAIN (COSTS OFF) SELECT * FROM clstr_expression WHERE -a = -3 ORDER BY -a, b;
                          QUERY PLAN                           
---------------------------------------------------------------
 Index Scan using clstr_expression_minus_a on clstr_expression
   Index Cond: ((- a) = '-3'::integer)
(2 rows)

SELECT * FROM clstr_expression WHERE -a = -3 ORDER BY -a, b;
 id  | a |     b     
-----+---+-----------
 129 | 3 | prefix129
   3 | 3 | prefix3
  45 | 3 | prefix45
  87 | 3 | prefix87
(4 rows)

COMMIT;
-- clean up
DROP TABLE clustertest;
DROP TABLE clstr_1;
DROP TABLE clstr_2;
DROP TABLE clstr_3;
DROP TABLE clstr_4;
ERROR:  table "clstr_4" does not exist
DROP TABLE clstr_expression;
