--
-- SUBSELECT
--
SELECT 1 AS one WHERE 1 IN (SELECT 1);
 one 
-----
   1
(1 row)

SELECT 1 AS zero WHERE 1 NOT IN (SELECT 1);
 zero 
------
(0 rows)

SELECT 1 AS zero WHERE 1 IN (SELECT 2);
 zero 
------
(0 rows)

-- Check grammar's handling of extra parens in assorted contexts
SELECT * FROM (SELECT 1 AS x) ss;
 x 
---
 1
(1 row)

SELECT * FROM ((SELECT 1 AS x)) ss;
 x 
---
 1
(1 row)

(SELECT 2) UNION SELECT 2;
ERROR:  set operations (UNION/INTERSECT/EXCEPT) are not supported in minipg
((SELECT 2)) UNION SELECT 2;
ERROR:  set operations (UNION/INTERSECT/EXCEPT) are not supported in minipg
SELECT ((SELECT 2) UNION SELECT 2);
ERROR:  set operations (UNION/INTERSECT/EXCEPT) are not supported in minipg
SELECT (((SELECT 2)) UNION SELECT 2);
ERROR:  set operations (UNION/INTERSECT/EXCEPT) are not supported in minipg
SELECT (SELECT ARRAY[1,2,3])[1];
 array 
-------
     1
(1 row)

SELECT ((SELECT ARRAY[1,2,3]))[2];
 array 
-------
     2
(1 row)

SELECT (((SELECT ARRAY[1,2,3])))[3];
 array 
-------
     3
(1 row)

-- Set up some simple test tables
CREATE TABLE SUBSELECT_TBL (
  f1 integer,
  f2 integer,
  f3 float
);
INSERT INTO SUBSELECT_TBL VALUES (1, 2, 3);
INSERT INTO SUBSELECT_TBL VALUES (2, 3, 4);
INSERT INTO SUBSELECT_TBL VALUES (3, 4, 5);
INSERT INTO SUBSELECT_TBL VALUES (1, 1, 1);
INSERT INTO SUBSELECT_TBL VALUES (2, 2, 2);
INSERT INTO SUBSELECT_TBL VALUES (3, 3, 3);
INSERT INTO SUBSELECT_TBL VALUES (6, 7, 8);
INSERT INTO SUBSELECT_TBL VALUES (8, 9, NULL);
SELECT * FROM SUBSELECT_TBL;
 f1 | f2 | f3 
----+----+----
  1 |  2 |  3
  2 |  3 |  4
  3 |  4 |  5
  1 |  1 |  1
  2 |  2 |  2
  3 |  3 |  3
  6 |  7 |  8
  8 |  9 |   
(8 rows)

-- Uncorrelated subselects
SELECT f1 AS "Constant Select" FROM SUBSELECT_TBL
  WHERE f1 IN (SELECT 1);
 Constant Select 
-----------------
               1
               1
(2 rows)

SELECT f1 AS "Uncorrelated Field" FROM SUBSELECT_TBL
  WHERE f1 IN (SELECT f2 FROM SUBSELECT_TBL);
 Uncorrelated Field 
--------------------
                  1
                  2
                  3
                  1
                  2
                  3
(6 rows)

SELECT f1 AS "Uncorrelated Field" FROM SUBSELECT_TBL
  WHERE f1 IN (SELECT f2 FROM SUBSELECT_TBL WHERE
    f2 IN (SELECT f1 FROM SUBSELECT_TBL));
 Uncorrelated Field 
--------------------
                  1
                  2
                  3
                  1
                  2
                  3
(6 rows)

SELECT f1, f2
  FROM SUBSELECT_TBL
  WHERE (f1, f2) NOT IN (SELECT f2, CAST(f3 AS int4) FROM SUBSELECT_TBL
                         WHERE f3 IS NOT NULL);
 f1 | f2 
----+----
  1 |  2
  6 |  7
  8 |  9
(3 rows)

-- Correlated subselects
SELECT f1 AS "Correlated Field", f2 AS "Second Field"
  FROM SUBSELECT_TBL upper
  WHERE f1 IN (SELECT f2 FROM SUBSELECT_TBL WHERE f1 = upper.f1);
 Correlated Field | Second Field 
------------------+--------------
                1 |            2
                2 |            3
                3 |            4
                1 |            1
                2 |            2
                3 |            3
(6 rows)

SELECT f1 AS "Correlated Field", f3 AS "Second Field"
  FROM SUBSELECT_TBL upper
  WHERE f1 IN
    (SELECT f2 FROM SUBSELECT_TBL WHERE CAST(upper.f2 AS float) = f3);
 Correlated Field | Second Field 
------------------+--------------
                2 |            4
                3 |            5
                1 |            1
                2 |            2
                3 |            3
(5 rows)

SELECT f1 AS "Correlated Field", f3 AS "Second Field"
  FROM SUBSELECT_TBL upper
  WHERE f3 IN (SELECT upper.f1 + f2 FROM SUBSELECT_TBL
               WHERE f2 = CAST(f3 AS integer));
 Correlated Field | Second Field 
------------------+--------------
                1 |            3
                2 |            4
                3 |            5
                6 |            8
(4 rows)

SELECT f1 AS "Correlated Field"
  FROM SUBSELECT_TBL
  WHERE (f1, f2) IN (SELECT f2, CAST(f3 AS int4) FROM SUBSELECT_TBL
                     WHERE f3 IS NOT NULL);
 Correlated Field 
------------------
                2
                3
                1
                2
                3
(5 rows)

--
-- Use some existing tables in the regression test
--
SELECT ss.f1 AS "Correlated Field", ss.f3 AS "Second Field"
  FROM SUBSELECT_TBL ss
  WHERE f1 NOT IN (SELECT f1+1 FROM INT4_TBL
                   WHERE f1 != ss.f1 AND f1 < 2147483647);
ERROR:  relation "int4_tbl" does not exist
LINE 3:   WHERE f1 NOT IN (SELECT f1+1 FROM INT4_TBL
                                            ^
select q1, float8(count(*)) / (select count(*) from int8_tbl)
from int8_tbl group by q1 order by q1;
ERROR:  relation "int8_tbl" does not exist
LINE 2: from int8_tbl group by q1 order by q1;
             ^
-- Unspecified-type literals in output columns should resolve as text
SELECT *, pg_typeof(f1) FROM
  (SELECT 'foo' AS f1 FROM generate_series(1,3)) ss ORDER BY 1;
 f1  | pg_typeof 
-----+-----------
 foo | text
 foo | text
 foo | text
(3 rows)

-- ... unless there's context to suggest differently
explain (verbose, costs off) select '42' union all select '43';
ERROR:  set operations (UNION/INTERSECT/EXCEPT) are not supported in minipg
explain (verbose, costs off) select '42' union all select 43;
ERROR:  set operations (UNION/INTERSECT/EXCEPT) are not supported in minipg
-- check materialization of an initplan reference (bug #14524)
explain (verbose, costs off)
select 1 = all (select (select 1));
            QUERY PLAN             
-----------------------------------
 Result
   Output: (SubPlan 2)
   SubPlan 2
     ->  Materialize
           Output: ($0)
           InitPlan 1 (returns $0)
             ->  Result
                   Output: 1
           ->  Result
                 Output: $0
(10 rows)

select 1 = all (select (select 1));
 ?column? 
----------
 t
(1 row)

--
-- Check EXISTS simplification with LIMIT
--
explain (costs off)
select * from int4_tbl o where exists
  (select 1 from int4_tbl i where i.f1=o.f1 limit null);
ERROR:  relation "int4_tbl" does not exist
LINE 2: select * from int4_tbl o where exists
                      ^
explain (costs off)
select * from int4_tbl o where not exists
  (select 1 from int4_tbl i where i.f1=o.f1 limit 1);
ERROR:  relation "int4_tbl" does not exist
LINE 2: select * from int4_tbl o where not exists
                      ^
explain (costs off)
select * from int4_tbl o where exists
  (select 1 from int4_tbl i where i.f1=o.f1 limit 0);
ERROR:  relation "int4_tbl" does not exist
LINE 2: select * from int4_tbl o where exists
                      ^
--
-- Test cases to catch unpleasant interactions between IN-join processing
-- and subquery pullup.
--
select count(*) from
  (select 1 from tenk1 a
   where unique1 IN (select hundred from tenk1 b)) ss;
ERROR:  relation "tenk1" does not exist
LINE 2:   (select 1 from tenk1 a
                         ^
select count(distinct ss.ten) from
  (select ten from tenk1 a
   where unique1 IN (select hundred from tenk1 b)) ss;
ERROR:  relation "tenk1" does not exist
LINE 2:   (select ten from tenk1 a
                           ^
select count(*) from
  (select 1 from tenk1 a
   where unique1 IN (select distinct hundred from tenk1 b)) ss;
ERROR:  relation "tenk1" does not exist
LINE 2:   (select 1 from tenk1 a
                         ^
select count(distinct ss.ten) from
  (select ten from tenk1 a
   where unique1 IN (select distinct hundred from tenk1 b)) ss;
ERROR:  relation "tenk1" does not exist
LINE 2:   (select ten from tenk1 a
                           ^
--
-- Test cases to check for overenthusiastic optimization of
-- "IN (SELECT DISTINCT ...)" and related cases.  Per example from
-- Luca Pireddu and Michael Fuhr.
--
CREATE TABLE foo (id integer);
CREATE TABLE bar (id1 integer, id2 integer);
INSERT INTO foo VALUES (1);
INSERT INTO bar VALUES (1, 1);
INSERT INTO bar VALUES (2, 2);
INSERT INTO bar VALUES (3, 1);
-- These cases require an extra level of distinct-ing above subquery s
SELECT * FROM foo WHERE id IN
    (SELECT id2 FROM (SELECT DISTINCT id1, id2 FROM bar) AS s);
 id 
----
  1
(1 row)

SELECT * FROM foo WHERE id IN
    (SELECT id2 FROM (SELECT id1,id2 FROM bar GROUP BY id1,id2) AS s);
 id 
----
  1
(1 row)

SELECT * FROM foo WHERE id IN
    (SELECT id2 FROM (SELECT id1, id2 FROM bar UNION
                      SELECT id1, id2 FROM bar) AS s);
ERROR:  set operations (UNION/INTERSECT/EXCEPT) are not supported in minipg
-- These cases do not
SELECT * FROM foo WHERE id IN
    (SELECT id2 FROM (SELECT DISTINCT ON (id2) id1, id2 FROM bar) AS s);
 id 
----
  1
(1 row)

SELECT * FROM foo WHERE id IN
    (SELECT id2 FROM (SELECT id2 FROM bar GROUP BY id2) AS s);
 id 
----
  1
(1 row)

SELECT * FROM foo WHERE id IN
    (SELECT id2 FROM (SELECT id2 FROM bar UNION
                      SELECT id2 FROM bar) AS s);
ERROR:  set operations (UNION/INTERSECT/EXCEPT) are not supported in minipg
--
-- Test case to catch problems with multiply nested sub-SELECTs not getting
-- recalculated properly.  Per bug report from Didier Moens.
--
CREATE TABLE orderstest (
    approver_ref integer,
    po_ref integer,
    ordercanceled boolean
);
INSERT INTO orderstest VALUES (1, 1, false);
INSERT INTO orderstest VALUES (66, 5, false);
INSERT INTO orderstest VALUES (66, 6, false);
INSERT INTO orderstest VALUES (66, 7, false);
INSERT INTO orderstest VALUES (66, 1, true);
INSERT INTO orderstest VALUES (66, 8, false);
INSERT INTO orderstest VALUES (66, 1, false);
INSERT INTO orderstest VALUES (77, 1, false);
INSERT INTO orderstest VALUES (1, 1, false);
INSERT INTO orderstest VALUES (66, 1, false);
INSERT INTO orderstest VALUES (1, 1, false);
CREATE VIEW orders_view AS
SELECT *,
(SELECT CASE
   WHEN ord.approver_ref=1 THEN '---' ELSE 'Approved'
 END) AS "Approved",
(SELECT CASE
 WHEN ord.ordercanceled
 THEN 'Canceled'
 ELSE
  (SELECT CASE
		WHEN ord.po_ref=1
		THEN
		 (SELECT CASE
				WHEN ord.approver_ref=1
				THEN '---'
				ELSE 'Approved'
			END)
		ELSE 'PO'
	END)
END) AS "Status",
(CASE
 WHEN ord.ordercanceled
 THEN 'Canceled'
 ELSE
  (CASE
		WHEN ord.po_ref=1
		THEN
		 (CASE
				WHEN ord.approver_ref=1
				THEN '---'
				ELSE 'Approved'
			END)
		ELSE 'PO'
	END)
END) AS "Status_OK"
FROM orderstest ord;
SELECT * FROM orders_view;
 approver_ref | po_ref | ordercanceled | Approved |  Status  | Status_OK 
--------------+--------+---------------+----------+----------+-----------
            1 |      1 | f             | ---      | ---      | ---
           66 |      5 | f             | Approved | PO       | PO
           66 |      6 | f             | Approved | PO       | PO
           66 |      7 | f             | Approved | PO       | PO
           66 |      1 | t             | Approved | Canceled | Canceled
           66 |      8 | f             | Approved | PO       | PO
           66 |      1 | f             | Approved | Approved | Approved
           77 |      1 | f             | Approved | Approved | Approved
            1 |      1 | f             | ---      | ---      | ---
           66 |      1 | f             | Approved | Approved | Approved
            1 |      1 | f             | ---      | ---      | ---
(11 rows)

DROP TABLE orderstest cascade;
NOTICE:  drop cascades to view orders_view
--
-- Test cases to catch situations where rule rewriter fails to propagate
-- hasSubLinks flag correctly.  Per example from Kyle Bateman.
--
CREATE TABLE parts (
    partnum     text,
    cost        float8
);
CREATE TABLE shipped (
    ttype       char(2),
    ordnum      int4,
    partnum     text,
    value       float8
);
CREATE VIEW shipped_view as
    select * from shipped where ttype = 'wt';
create rule shipped_view_insert as on insert to shipped_view do instead
    insert into shipped values('wt', new.ordnum, new.partnum, new.value);
insert into parts (partnum, cost) values (1, 1234.56);
insert into shipped_view (ordnum, partnum, value)
    values (0, 1, (select cost from parts where partnum = '1'));
select * from shipped_view;
 ttype | ordnum | partnum |  value  
-------+--------+---------+---------
 wt    |      0 | 1       | 1234.56
(1 row)

create rule shipped_view_update as on update to shipped_view do instead
    update shipped set partnum = new.partnum, value = new.value
        where ttype = new.ttype and ordnum = new.ordnum;
update shipped_view set value = 11
    from int4_tbl a join int4_tbl b
      on (a.f1 = (select f1 from int4_tbl c where c.f1=b.f1))
    where ordnum = a.f1;
ERROR:  relation "int4_tbl" does not exist
LINE 2:     from int4_tbl a join int4_tbl b
                 ^
select * from shipped_view;
 ttype | ordnum | partnum |  value  
-------+--------+---------+---------
 wt    |      0 | 1       | 1234.56
(1 row)

select f1, ss1 as relabel from
    (select *, (select sum(f1) from int4_tbl b where f1 >= a.f1) as ss1
     from int4_tbl a) ss;
ERROR:  relation "int4_tbl" does not exist
LINE 3:      from int4_tbl a) ss;
                  ^
--
-- Test cases involving PARAM_EXEC parameters and min/max index optimizations.
-- Per bug report from David Sanchez i Gregori.
--
select * from (
  select max(unique1) from tenk1 as a
  where exists (select 1 from tenk1 as b where b.thousand = a.unique2)
) ss;
ERROR:  relation "tenk1" does not exist
LINE 2:   select max(unique1) from tenk1 as a
                                   ^
select * from (
  select min(unique1) from tenk1 as a
  where not exists (select 1 from tenk1 as b where b.unique2 = 10000)
) ss;
ERROR:  relation "tenk1" does not exist
LINE 2:   select min(unique1) from tenk1 as a
                                   ^
--
-- Test that an IN implemented using a UniquePath does unique-ification
-- with the right semantics, as per bug #4113.  (Unfortunately we have
-- no simple way to ensure that this test case actually chooses that type
-- of plan, but it does in releases 7.4-8.3.  Note that an ordering difference
-- here might mean that some other plan type is being used, rendering the test
-- pointless.)
--
CREATE TABLE numeric_table (num_col numeric);
ERROR:  syntax error at or near "numeric"
LINE 1: CREATE TABLE numeric_table (num_col numeric);
                                            ^
insert into numeric_table values (1), (1.000000000000000000001), (2), (3);
ERROR:  relation "numeric_table" does not exist
LINE 1: insert into numeric_table values (1), (1.0000000000000000000...
                    ^
CREATE TABLE float_table (float_col float8);
insert into float_table values (1), (2), (3);
select * from float_table
  where float_col in (select num_col from numeric_table);
ERROR:  relation "numeric_table" does not exist
LINE 2:   where float_col in (select num_col from numeric_table);
                                                  ^
select * from numeric_table
  where num_col in (select float_col from float_table);
ERROR:  relation "numeric_table" does not exist
LINE 1: select * from numeric_table
                      ^
--
-- Test case for bug #4290: bogus calculation of subplan param sets
--
CREATE TABLE ta (id int primary key, val int);
insert into ta values(1,1);
insert into ta values(2,2);
CREATE TABLE tb (id int primary key, aval int);
insert into tb values(1,1);
insert into tb values(2,1);
insert into tb values(3,2);
insert into tb values(4,2);
CREATE TABLE tc (id int primary key, aid int);
insert into tc values(1,1);
insert into tc values(2,2);
select
  ( select min(tb.id) from tb
    where tb.aval = (select ta.val from ta where ta.id = tc.aid) ) as min_tb_id
from tc;
 min_tb_id 
-----------
         1
         3
(2 rows)

--
-- Test case for 8.3 "failed to locate grouping columns" bug
--
CREATE TABLE t1 (f1 numeric(14,0), f2 varchar(30));
ERROR:  syntax error at or near "numeric"
LINE 1: CREATE TABLE t1 (f1 numeric(14,0), f2 varchar(30));
                            ^
select * from
  (select distinct f1, f2, (select f2 from t1 x where x.f1 = up.f1) as fs
   from t1 up) ss
group by f1,f2,fs;
ERROR:  relation "t1" does not exist
LINE 3:    from t1 up) ss
                ^
--
-- Test case for bug #5514 (mishandling of whole-row Vars in subselects)
--
CREATE TABLE table_a(id integer);
insert into table_a values (42);
CREATE VIEW view_a as select * from table_a;
select view_a from view_a;
 view_a 
--------
 (42)
(1 row)

select (select view_a) from view_a;
 view_a 
--------
 (42)
(1 row)

select (select (select view_a)) from view_a;
 view_a 
--------
 (42)
(1 row)

select (select (a.*)::text) from view_a a;
  a   
------
 (42)
(1 row)

--
-- Check that whole-row Vars reading the result of a subselect don't include
-- any junk columns therein
--
select q from (select max(f1) from int4_tbl group by f1 order by f1) q;
ERROR:  relation "int4_tbl" does not exist
LINE 1: select q from (select max(f1) from int4_tbl group by f1 orde...
                                           ^
--
-- Test case for sublinks pulled up into joinaliasvars lists in an
-- inherited update/delete query
--
begin;  --  this shouldn't delete anything, but be safe
delete from road
where exists (
  select 1
  from
    int4_tbl cross join
    ( select f1, array(select q1 from int8_tbl) as arr
      from text_tbl ) ss
  where road.name = ss.f1 );
ERROR:  relation "road" does not exist
LINE 1: delete from road
                    ^
rollback;
--
-- Test case for sublinks pushed down into subselects via join alias expansion
--
select
  (select sq1) as qq1
from
  (select exists(select 1 from int4_tbl where f1 = q2) as sq1, 42 as dummy
   from int8_tbl) sq0
  join
  int4_tbl i4 on dummy = i4.f1;
ERROR:  relation "int8_tbl" does not exist
LINE 5:    from int8_tbl) sq0
                ^
--
-- Test case for subselect within UPDATE of INSERT...ON CONFLICT DO UPDATE
--
CREATE TABLE upsert(key int4 primary key, val text);
insert into upsert values(1, 'val') on conflict (key) do update set val = 'not seen';
insert into upsert values(1, 'val') on conflict (key) do update set val = 'seen with subselect ' || (select f1 from int4_tbl where f1 != 0 limit 1)::text;
ERROR:  relation "int4_tbl" does not exist
LINE 1: ...t val = 'seen with subselect ' || (select f1 from int4_tbl w...
                                                             ^
select * from upsert;
 key | val 
-----+-----
   1 | val
(1 row)

insert into upsert values (1, 'x'), (999, 'y')
on conflict (key) do update set val = (select u from (select 'int4_tbl' u from int4_tbl limit 1) aa)
returning *;
ERROR:  relation "int4_tbl" does not exist
LINE 2: ...et val = (select u from (select 'int4_tbl' u from int4_tbl l...
                                                             ^
--
-- Test case for cross-type partial matching in hashed subplan (bug #7597)
--
CREATE TABLE outer_7597 (f1 int4, f2 int4);
insert into outer_7597 values (0, 0);
insert into outer_7597 values (1, 0);
insert into outer_7597 values (0, null);
insert into outer_7597 values (1, null);
CREATE TABLE inner_7597(c1 int8, c2 int8);
insert into inner_7597 values(0, null);
select * from outer_7597 where (f1, f2) not in (select * from inner_7597);
 f1 | f2 
----+----
  1 |  0
  1 |   
(2 rows)

--
-- Similar test case using text that verifies that collation
-- information is passed through by execTuplesEqual() in nodeSubplan.c
-- (otherwise it would error in texteq())
--
CREATE TABLE outer_text (f1 text, f2 text);
insert into outer_text values ('a', 'a');
insert into outer_text values ('b', 'a');
insert into outer_text values ('a', null);
insert into outer_text values ('b', null);
CREATE TABLE inner_text (c1 text, c2 text);
insert into inner_text values ('a', null);
insert into inner_text values ('123', '456');
select * from outer_text where (f1, f2) not in (select * from inner_text);
 f1 | f2 
----+----
 b  | a
 b  | 
(2 rows)

--
-- Another test case for cross-type hashed subplans: comparison of
-- inner-side values must be done with appropriate operator
--
explain (verbose, costs off)
select 'foo'::text in (select 'bar'::name union all select 'bar'::name);
ERROR:  set operations (UNION/INTERSECT/EXCEPT) are not supported in minipg
select 'foo'::text in (select 'bar'::name union all select 'bar'::name);
ERROR:  set operations (UNION/INTERSECT/EXCEPT) are not supported in minipg
--
-- Test that we don't try to hash nested records (bug #17363)
-- (Hashing could be supported, but for now we don't)
--
explain (verbose, costs off)
select row(row(row(1))) = any (select row(row(1)));
                QUERY PLAN                 
-------------------------------------------
 Result
   Output: (SubPlan 1)
   SubPlan 1
     ->  Materialize
           Output: '("(1)")'::record
           ->  Result
                 Output: '("(1)")'::record
(7 rows)

select row(row(row(1))) = any (select row(row(1)));
 ?column? 
----------
 t
(1 row)

--
-- Test case for premature memory release during hashing of subplan output
--
select '1'::text in (select '1'::name union all select '1'::name);
ERROR:  set operations (UNION/INTERSECT/EXCEPT) are not supported in minipg
--
-- Test resolution of hashed vs non-hashed implementation of EXISTS subplan
--
explain (costs off)
select count(*) from tenk1 t
where (exists(select 1 from tenk1 k where k.unique1 = t.unique2) or ten < 0);
ERROR:  relation "tenk1" does not exist
LINE 2: select count(*) from tenk1 t
                             ^
select count(*) from tenk1 t
where (exists(select 1 from tenk1 k where k.unique1 = t.unique2) or ten < 0);
ERROR:  relation "tenk1" does not exist
LINE 1: select count(*) from tenk1 t
                             ^
explain (costs off)
select count(*) from tenk1 t
where (exists(select 1 from tenk1 k where k.unique1 = t.unique2) or ten < 0)
  and thousand = 1;
ERROR:  relation "tenk1" does not exist
LINE 2: select count(*) from tenk1 t
                             ^
select count(*) from tenk1 t
where (exists(select 1 from tenk1 k where k.unique1 = t.unique2) or ten < 0)
  and thousand = 1;
ERROR:  relation "tenk1" does not exist
LINE 1: select count(*) from tenk1 t
                             ^
-- It's possible for the same EXISTS to get resolved both ways
CREATE TABLE exists_tbl (c1 int, c2 int, c3 int) partition by list (c1);
ERROR:  syntax error at or near "partition"
LINE 1: CREATE TABLE exists_tbl (c1 int, c2 int, c3 int) partition b...
                                                         ^
CREATE TABLE exists_tbl_null partition of exists_tbl for values in (null);
ERROR:  syntax error at or near "partition"
LINE 1: CREATE TABLE exists_tbl_null partition of exists_tbl for val...
                                     ^
CREATE TABLE exists_tbl_def partition of exists_tbl default;
ERROR:  syntax error at or near "partition"
LINE 1: CREATE TABLE exists_tbl_def partition of exists_tbl default;
                                    ^
insert into exists_tbl select x, x/2, x+1 from generate_series(0,10) x;
ERROR:  relation "exists_tbl" does not exist
LINE 1: insert into exists_tbl select x, x/2, x+1 from generate_seri...
                    ^
analyze exists_tbl;
ERROR:  relation "exists_tbl" does not exist
explain (costs off)
select * from exists_tbl t1
  where (exists(select 1 from exists_tbl t2 where t1.c1 = t2.c2) or c3 < 0);
ERROR:  relation "exists_tbl" does not exist
LINE 2: select * from exists_tbl t1
                      ^
select * from exists_tbl t1
  where (exists(select 1 from exists_tbl t2 where t1.c1 = t2.c2) or c3 < 0);
ERROR:  relation "exists_tbl" does not exist
LINE 1: select * from exists_tbl t1
                      ^
--
-- Test case for planner bug with nested EXISTS handling
--
select a.thousand from tenk1 a, tenk1 b
where a.thousand = b.thousand
  and exists ( select 1 from tenk1 c where b.hundred = c.hundred
                   and not exists ( select 1 from tenk1 d
                                    where a.thousand = d.thousand ) );
ERROR:  relation "tenk1" does not exist
LINE 1: select a.thousand from tenk1 a, tenk1 b
                               ^
--
-- Check that nested sub-selects are not pulled up if they contain volatiles
--
explain (verbose, costs off)
  select x, x from
    (select (select now()) as x from (values(1),(2)) v(y)) ss;
        QUERY PLAN         
---------------------------
 Values Scan on "*VALUES*"
   Output: $0, $1
   InitPlan 1 (returns $0)
     ->  Result
           Output: now()
   InitPlan 2 (returns $1)
     ->  Result
           Output: now()
(8 rows)

explain (verbose, costs off)
  select x, x from
    (select (select random()) as x from (values(1),(2)) v(y)) ss;
            QUERY PLAN            
----------------------------------
 Subquery Scan on ss
   Output: ss.x, ss.x
   ->  Values Scan on "*VALUES*"
         Output: $0
         InitPlan 1 (returns $0)
           ->  Result
                 Output: random()
(7 rows)

explain (verbose, costs off)
  select x, x from
    (select (select now() where y=y) as x from (values(1),(2)) v(y)) ss;
                              QUERY PLAN                              
----------------------------------------------------------------------
 Values Scan on "*VALUES*"
   Output: (SubPlan 1), (SubPlan 2)
   SubPlan 1
     ->  Result
           Output: now()
           One-Time Filter: ("*VALUES*".column1 = "*VALUES*".column1)
   SubPlan 2
     ->  Result
           Output: now()
           One-Time Filter: ("*VALUES*".column1 = "*VALUES*".column1)
(10 rows)

explain (verbose, costs off)
  select x, x from
    (select (select random() where y=y) as x from (values(1),(2)) v(y)) ss;
                                 QUERY PLAN                                 
----------------------------------------------------------------------------
 Subquery Scan on ss
   Output: ss.x, ss.x
   ->  Values Scan on "*VALUES*"
         Output: (SubPlan 1)
         SubPlan 1
           ->  Result
                 Output: random()
                 One-Time Filter: ("*VALUES*".column1 = "*VALUES*".column1)
(8 rows)

--
-- Test rescan of a hashed subplan (the use of random() is to prevent the
-- sub-select from being pulled up, which would result in not hashing)
--
explain (verbose, costs off)
select sum(ss.tst::int) from
  onek o cross join lateral (
  select i.ten in (select f1 from int4_tbl where f1 <= o.hundred) as tst,
         random() as r
  from onek i where i.unique1 = o.unique1 ) ss
where o.ten = 0;
ERROR:  relation "onek" does not exist
LINE 3:   onek o cross join lateral (
          ^
select sum(ss.tst::int) from
  onek o cross join lateral (
  select i.ten in (select f1 from int4_tbl where f1 <= o.hundred) as tst,
         random() as r
  from onek i where i.unique1 = o.unique1 ) ss
where o.ten = 0;
ERROR:  relation "onek" does not exist
LINE 2:   onek o cross join lateral (
          ^
--
-- Test rescan of a SetOp node
--
explain (costs off)
select count(*) from
  onek o cross join lateral (
    select * from onek i1 where i1.unique1 = o.unique1
    except
    select * from onek i2 where i2.unique1 = o.unique2
  ) ss
where o.ten = 1;
ERROR:  set operations (UNION/INTERSECT/EXCEPT) are not supported in minipg
select count(*) from
  onek o cross join lateral (
    select * from onek i1 where i1.unique1 = o.unique1
    except
    select * from onek i2 where i2.unique1 = o.unique2
  ) ss
where o.ten = 1;
ERROR:  set operations (UNION/INTERSECT/EXCEPT) are not supported in minipg
--
-- Check we don't misoptimize a NOT IN where the subquery returns no rows.
--
CREATE TABLE notinouter (a int);
CREATE TABLE notininner (b int not null);
insert into notinouter values (null), (1);
select * from notinouter where a not in (select b from notininner);
 a 
---
  
 1
(2 rows)

--
-- Check we behave sanely in corner case of empty SELECT list (bug #8648)
--
CREATE TABLE nocolumns();
select exists(select * from nocolumns);
 exists 
--------
 f
(1 row)

--
-- Check behavior with a SubPlan in VALUES (bug #14924)
--
select val.x
  from generate_series(1,10) as s(i),
  lateral (
    values ((select s.i + 1)), (s.i + 101)
  ) as val(x)
where s.i < 10 and (select val.x) < 110;
  x  
-----
   2
 102
   3
 103
   4
 104
   5
 105
   6
 106
   7
 107
   8
 108
   9
 109
  10
(17 rows)

-- another variant of that (bug #16213)
explain (verbose, costs off)
select * from
(values
  (3 not in (select * from (values (1), (2)) ss1)),
  (false)
) ss;
               QUERY PLAN               
----------------------------------------
 Values Scan on "*VALUES*"
   Output: "*VALUES*".column1
   SubPlan 1
     ->  Values Scan on "*VALUES*_1"
           Output: "*VALUES*_1".column1
(5 rows)

select * from
(values
  (3 not in (select * from (values (1), (2)) ss1)),
  (false)
) ss;
 column1 
---------
 t
 f
(2 rows)

--
-- Check sane behavior with nested IN SubLinks
--
explain (verbose, costs off)
select * from int4_tbl where
  (case when f1 in (select unique1 from tenk1 a) then f1 else null end) in
  (select ten from tenk1 b);
ERROR:  relation "int4_tbl" does not exist
LINE 2: select * from int4_tbl where
                      ^
select * from int4_tbl where
  (case when f1 in (select unique1 from tenk1 a) then f1 else null end) in
  (select ten from tenk1 b);
ERROR:  relation "int4_tbl" does not exist
LINE 1: select * from int4_tbl where
                      ^
--
-- Check for incorrect optimization when IN subquery contains a SRF
--
explain (verbose, costs off)
select * from int4_tbl o where (f1, f1) in
  (select f1, generate_series(1,50) / 10 g from int4_tbl i group by f1);
ERROR:  relation "int4_tbl" does not exist
LINE 2: select * from int4_tbl o where (f1, f1) in
                      ^
select * from int4_tbl o where (f1, f1) in
  (select f1, generate_series(1,50) / 10 g from int4_tbl i group by f1);
ERROR:  relation "int4_tbl" does not exist
LINE 1: select * from int4_tbl o where (f1, f1) in
                      ^
--
-- check for over-optimization of whole-row Var referencing an Append plan
--
select (select q from
         (select 1,2,3 where f1 > 0
          union all
          select 4,5,6.0 where f1 <= 0
         ) q )
from int4_tbl;
ERROR:  set operations (UNION/INTERSECT/EXCEPT) are not supported in minipg
--
-- Check for sane handling of a lateral reference in a subquery's quals
-- (most of the complication here is to prevent the test case from being
-- flattened too much)
--
explain (verbose, costs off)
select * from
    int4_tbl i4,
    lateral (
        select i4.f1 > 1 as b, 1 as id
        from (select random() order by 1) as t1
      union all
        select true as b, 2 as id
    ) as t2
where b and f1 >= 0;
ERROR:  set operations (UNION/INTERSECT/EXCEPT) are not supported in minipg
select * from
    int4_tbl i4,
    lateral (
        select i4.f1 > 1 as b, 1 as id
        from (select random() order by 1) as t1
      union all
        select true as b, 2 as id
    ) as t2
where b and f1 >= 0;
ERROR:  set operations (UNION/INTERSECT/EXCEPT) are not supported in minipg
--
-- Check that volatile quals aren't pushed down past a DISTINCT:
-- nextval() should not be called more than the nominal number of times
--
CREATE SEQUENCE ts1;
ERROR:  syntax error at or near "SEQUENCE"
LINE 1: CREATE SEQUENCE ts1;
               ^
select * from
  (select distinct ten from tenk1) ss
  where ten < 10 + nextval('ts1')
  order by 1;
ERROR:  relation "tenk1" does not exist
LINE 2:   (select distinct ten from tenk1) ss
                                    ^
select nextval('ts1');
ERROR:  function nextval(unknown) does not exist
LINE 1: select nextval('ts1');
               ^
HINT:  No function matches the given name and argument types. You might need to add explicit type casts.
--
-- Check that volatile quals aren't pushed down past a set-returning function;
-- while a nonvolatile qual can be, if it doesn't reference the SRF.
--
-- minipg: PL/pgSQL removed. SQL equivalent (returns x > y). The original
-- raised NOTICEs per call; those notices are dropped but the EXPLAIN plans
-- that this test actually asserts on are unchanged.
create function tattle(x int, y int) returns bool
volatile language sql as $$
  SELECT x > y;
$$;
explain (verbose, costs off)
select * from
  (select 9 as x, unnest(array[1,2,3,11,12,13]) as u) ss
  where tattle(x, 8);
                     QUERY PLAN                     
----------------------------------------------------
 ProjectSet
   Output: 9, unnest('{1,2,3,11,12,13}'::integer[])
   ->  Result
(3 rows)

select * from
  (select 9 as x, unnest(array[1,2,3,11,12,13]) as u) ss
  where tattle(x, 8);
 x | u  
---+----
 9 |  1
 9 |  2
 9 |  3
 9 | 11
 9 | 12
 9 | 13
(6 rows)

-- if we pretend it's stable, we get different results:
alter function tattle(x int, y int) stable;
ERROR:  syntax error at or near "function"
LINE 1: alter function tattle(x int, y int) stable;
              ^
explain (verbose, costs off)
select * from
  (select 9 as x, unnest(array[1,2,3,11,12,13]) as u) ss
  where tattle(x, 8);
                     QUERY PLAN                     
----------------------------------------------------
 ProjectSet
   Output: 9, unnest('{1,2,3,11,12,13}'::integer[])
   ->  Result
(3 rows)

select * from
  (select 9 as x, unnest(array[1,2,3,11,12,13]) as u) ss
  where tattle(x, 8);
 x | u  
---+----
 9 |  1
 9 |  2
 9 |  3
 9 | 11
 9 | 12
 9 | 13
(6 rows)

-- although even a stable qual should not be pushed down if it references SRF
explain (verbose, costs off)
select * from
  (select 9 as x, unnest(array[1,2,3,11,12,13]) as u) ss
  where tattle(x, u);
                        QUERY PLAN                        
----------------------------------------------------------
 Subquery Scan on ss
   Output: ss.x, ss.u
   Filter: (ss.x > ss.u)
   ->  ProjectSet
         Output: 9, unnest('{1,2,3,11,12,13}'::integer[])
         ->  Result
(6 rows)

select * from
  (select 9 as x, unnest(array[1,2,3,11,12,13]) as u) ss
  where tattle(x, u);
 x | u 
---+---
 9 | 1
 9 | 2
 9 | 3
(3 rows)

drop function tattle(x int, y int);
--
-- Test that LIMIT can be pushed to SORT through a subquery that just projects
-- columns.  We check for that having happened by looking to see if EXPLAIN
-- ANALYZE shows that a top-N sort was used.  We must suppress or filter away
-- all the non-invariant parts of the EXPLAIN ANALYZE output.
--
create table sq_limit (pk int primary key, c1 int, c2 int);
insert into sq_limit values
    (1, 1, 1),
    (2, 2, 2),
    (3, 3, 3),
    (4, 4, 4),
    (5, 1, 1),
    (6, 2, 2),
    (7, 3, 3),
    (8, 4, 4);
-- minipg: PL/pgSQL removed. The original used a plpgsql function to normalize
-- the non-deterministic "Memory: NkB" field of EXPLAIN ANALYZE output. Use a
-- costs-off EXPLAIN instead, which is deterministic, to verify LIMIT is pushed
-- to the top-N sort.
explain (costs off)
select * from (select pk,c2 from sq_limit order by c1,pk) as x limit 3;
                    QUERY PLAN                    
--------------------------------------------------
 Limit
   ->  Subquery Scan on x
         ->  Sort
               Sort Key: sq_limit.c1, sq_limit.pk
               ->  Seq Scan on sq_limit
(5 rows)

select * from (select pk,c2 from sq_limit order by c1,pk) as x limit 3;
 pk | c2 
----+----
  1 |  1
  5 |  1
  2 |  2
(3 rows)

drop table sq_limit;
-- minipg: SQL cursors are removed, so the backward-scan-direction test for
-- expression subqueries (bug #15336) is dropped; it required a scroll cursor
-- to fetch backward.
